headline,body
‘Gang of 4 behind Hasina’s fall’,"An Awami League leader has blamed Sheikh Hasina's inner circle, who he described as the ""Gang of Four that cut her off from the ground reality"", for her fall and departure, reports The Indian Express. The Indian Express spoke to several leaders of the party who feel Hasina has abandoned them in such a situation that put their lives in danger with angry mobs targetting their homes and businesses. ""We were able to get out of our homes just in time, when the Army chief was addressing the nation around 3pm and people were glued to TV screens,"" one of the Awami League leaders told the Indian newspaper. ""My family and I would have been lynched and burnt alive had we been caught,"" another leader, who was a minister, said. The Indian Express said some of the Awami League leaders regretted the turn of events, especially the firing at the students and protesters in July, and then on August 3-4 when people came out on the streets. One of the leaders alleged that Hasina stopped listening to them, as he blamed her inner circle ""the Gang of Four"". He named Hasina's son and ICT adviser Sajeeb Wazed Joy, private industry and investment adviser Salman F Rahman, Awami League General Secretary Obaidul Quader and the then home minister Asaduzzaman Khan. ""This Gang of Four led to her downfall. She had blind faith in these people, and lost the political instinct that she had in the past,"" The Indian Express quoted him as saying. The Awami League leaders also described not bringing the BNP on board for the elections in January as Hasina's ""major mistake"". Citing sources, the newspaper said some AL leaders were put in touch with Tarique Rahman, the BNP acting chairman in exile in London, through intermediaries. But Hasina did not greenlight the proposal to establish a backchannel with Tarique in January 2023, a year before the elections. Tarique was convicted of plotting the grenade attack that targeted Hasina at an Awami League rally in 2004. ""We could sense the anger among the people due to corruption, chandabaaji (extortion), police atrocities… and getting BNP on board for the elections would have taken that steam off. We could have still won and kept the party in power,"" the AL leader told The Indian Express. Even during the protests in early July, the AL leaders' bid to make Hasina meet the student movement leaders had failed, it said, citing sources. ""The last nail in the coffin was when the Detective Branch picked up the student leaders in July and released them after intimidating them and extracting a commitment to withdraw the agitation,"" the newspaper wrote. ""The tactic backfired, and the students made it public how they had been forcibly asked to withdraw the agitation. This triggered a chain of events, leading to her flight from the country."" The Bangladesh Army in a statement said it had provided shelter to 626 people from different walks of life, including 24 political leaders, five judges, 19 civil administration officials and 28 police officers, after the downfall of Hasina. Several top AL leaders, including members of her cabinet, have been arrested in cases over killings during the protests. Those who spoke to The India Express also feel the party, which spearheaded Bangladesh's struggle for independence after its formation 75 years ago, still has the ability to turn around despite the existential crisis. Fir this to happen, they told the Indian newspaper, Hasina should nominate people on the ground who have a connection with the people. ""This is going to be a long haul,"" one of the leaders said, talking about the future first steps …. People are still angry… We have to give them time."""
Rooppur power plant scam: Petition seeks ACC probe into allegation against Hasina,"A writ petition was filed with the High Court today seeking its order on the Anti-Corruption Commission (ACC) to conduct an inquiry into the allegation against former prime minister Sheikh Hasina, her son Sajeeb Wazed Joy and niece Tulip Siddiq of embezzling Tk 500 crore from Rooppur Nuclear Power Plant through Malaysian banks. Nationalist Democratic Movement (NDM) Chairman Bobby Hajjaj filed the petition as a public interest litigation through lawyer Sahedul Azam to the HC. Barrister Sahedul Azam told The Daily Star that he will move the petition before the HC after its reopening following upcoming annual vacation. Both the Appellate and HC Divisions of the Supreme Court will go on an annual vacation on September 6 and will reopen on October 20."
Hasina sued in five more murder cases,"Former prime minister Sheikh Hasina was sued in five more murder cases over the deaths of five people in the capital's Jatrabari and Dhanmondi areas between July 19 and August 14. Hasina is now facing at least 90 cases, mostly for murders during the mass student protests that forced her to resign and flee the country on August 5. In the cases, former ministers Obaidul Quader, Asaduzzaman Khan Kamal, Hasan Mahmud, Jahangir Kabir Nanak, and Dr Samanta Lal Sen, former lawmakers Shamim Osman, Nazrul Islam Babu, Ferdous Ahmed, and Mashiur Rahman Mollah Sajal, former IGP Chowdhury Abdullah Al-Mamun, and former DB additional commissioner Harun Or Rashid have also been made accused, among others. Four of those cases were filed with the court of Dhaka Metropolitan Magistrate Saddam Hossain. After recording the complainants' statements in the four cases, the magistrate asked the officer-in-charge of Jatrabari Police Sation to register the complainants as first information report, said court sources. One Mohammad Ali filed a case against Hasina and 57 others over the death of his relative Obaidul Islam on August 4. According to the case statement, leaders and activists of the AL-led 14-party alliance fired on thousands of people with illegal weapons in front of Kajla Petrol Pump in Jatrabari on August 4 during the anti-discrimination student movement, where Obaidul died of bullet injuries. One Rubel filed a case against Hasina and 35 others over the death of his brother Rasel in the Kajla area on August 5. One Mariam filed a case against Hasina and 93 others over the death of her son Saif Arafat Sharif, while Shilpi Akter filed another case against Hasina and 12 others over the death of his son Saidul Islam Yeasin. In the cases' statements, the complainants said Sharif and Yeasin were killed in front of Jatrabari Police Station on August 14 by the accused, while they were managing traffic there. Meanwhile, one Renu filed a case with the court of Dhaka Metropolitan Magistrate Faraha Diba Chanda against Hasina and 137 others over the death of her son Shuvo during quota reform protests. According to case statement, Shuvo suffered bullet injuries in Dhanmondi on July 19 and died the next day while undergoing treatment at a city hospital. After recording the statement, the magistrate directed the PBI to investigate the complaint and submit a report. MORE CASES AGAINST AL LEADERS Former minister Amir Hossain Amu, former lawmaker Shahjahan Omar, who joined AL after leaving BNP before January 7 polls, and 60 others have been sued on charge of attacking students during protests on August 4 in Jhalakathi town. Bittoy Kumar Sarkar alias Keshob Sarkar, vice-president of Jhalakathi district unit Chattra Dal, filed the case. In Tangail, a case has been filed against 34 leaders and activists of district AL men over the attack on Gono Odhikar Parishad members at Mawlana Bhashani Science and Technology University. Md Shakiluzzaman, its central office secretary, filed the case with Tangail Sadar Police Station yesterday. In Chattogram, CNG-run autorickshaw driver Md Anwar Hossain sued former ministers Hasan Mahmud, Mohibul Hassan Chowdhoury, and 300 others yesterday for injuring him by opening fire on August 5 in the city's Double Mooring area. In Thakurgaon, former water resources minister Ramesh Sen, former lawmaker Mazharul Islam Sujan, and 89 others were accused in a case filed over the death of a youth in a gas cylinder explosion at a house in Thakurgaon municipality on August 5."
How Hasina’s playbook was undone,"In her final days, Sheikh Hasina desperately clung to power as if she had full legitimacy, unmindful of a big crack in her armour. Her edifice crumbled a month ago on August 5. She fled Bangladesh, ending her iron-fisted rule of 15 years and leaving behind a legacy that established brutal authority over almost everything. A generation, to say the least, will remember her as a byname for intolerance to dissent, destruction of democratic institutions, rigged elections and utmost savagery in some cases. Sadly, her role in Bangladesh's economic prosperity for which she was feted globally will be a faded memory. The month leading to Hasina's dramatic downfall was littered with death and destruction. Trigger-happy security forces, who were blamed for hundreds of deaths as the protests turned violent in mid-July, were out with full force. Videos of police shooting point-blank at nonviolent protesters emerged almost every day. Her brutal tactics led to an unprecedented bloodbath in any mass uprising in the region in memory. Dystopian scenes vividly captured in photographs and videos by this newspaper as well as other media outlets will remain etched in our memory. Bangladesh became a symbol of nervous trauma. It was as if things were disintegrating from the centre. It also showed how peaceful protests lumbered into mindless mayhem. At one point, Hasina's government ordered a complete shutdown of the internet, the modern-day lifeline, knocking daily life out of balance, and taking Bangladesh back to the forgotten analogue age. That didn't quell the protests, started by university students but by now joined by people of every class and age groups, including women and children. The government deployed platoons of paramilitary troops alongside the police to stem the ferocity of demonstrations with teargas shells, rubber bullets and gunfire. But the day wasn't saved as one act of vengeance spawned another round of violence. Hasina's party unleashed its youth wing on the streets to reclaim their turf. Bloodbath continued unchecked. The death toll climbed. Hasina's government admitted, for the first time, that they were pushed to the wall, a comment that came with horrific finality. It was a precursor to something more ominous -- curfew. The deployment of the army on July 19, while it was undeniably necessary, tore the veil of stability that gave a fillip to the economy for more than a decade. The story of stability, sellable to foreign investors, lost much of its credibility. It also showed the government's struggle in its new term to hold things together as Bangladesh hurtled into an uncertain future. DAYS OF UNYIELDING ANGER Protests, anger and vengeance inhabited the period from July 16 to August 6. With the passing of each day, protests turned more violent and the mob burgeoned. In speed and scope, the violence went far beyond anything Hasina believed possible. Government establishments and vehicles were set on fire and two metro stations were vandalised in Mirpur. For their part, law enforcement agencies unleashed aerial fury by raining down rubber bullets and teargas shells on protesters from the sky, a newfound tactic. Street vendors and pedestrians were unwitting victims of the government's vengeance. Ambulances, their sirens on, ferried the injured to hospitals, stretching health services in Dhaka and beyond. According to an initial count by the United Nations, 650 people were killed in Bangladesh with nearly 400 deaths reported from July 16 to August 4, and a further 250 in the new wave of violence between August 5-6. The health adviser in the interim government later said the death toll could be as high as 1,000. The Daily Star has so far been able to confirm more than 550 deaths. The weight of the dead was too heavy. Shortly before midday, on August 5, Hasina was seen hurrying into a waiting helicopter in a disgraceful exit from Bangladesh. Her departure, which came after she lost the army's support, sparked jubilation across the country. Millions of people descended on the streets to celebrate the fall of her government, a significant turning point in the nation's history, amid dramatic and sometimes chaotic events. As the news of her exit spread, the day became more volatile. The entire nation was in flux. Thousands of people stormed Gono Bhaban, the prime minister's official residence, looting souvenirs, frolicking on the premises and grinning for selfies as they posed with the loot. People toppled a statue of independence leader and Hasina's father, Sheikh Mujibur Rahman. Arsonists set fire to the Bangabandhu Museum in Dhanmondi, in what the Crisis Group said was ""an act of grotesque retribution"". Reprisal attacks on Awami League leaders, sympathisers and religious minorities continued for the next few days.  It was almost unthinkable in January that Hasina's government would fall apart, just seven months into her fourth consecutive term, however deeply flawed the election may be. But support for the government was clearly waning. The largest opposition force, the Bangladesh Nationalist Party, had boycotted the vote and turnout was conspicuously low. Global leaders were hesitant to congratulate Hasina on the win. Hasina returned to power after winning the 2008 election in a landslide, but she seemed to have lost confidence along the way and rigged the subsequent three elections to hold on to power. And the regime became increasingly unaccountable for its wrongdoing. Internally, her overbearing presence hollowed out the party and other members lost their voices and roles. It morphed into a one-person party, and as such, a one-person government. Hasina concentrated so much power in her hands and antagonised many who came into her orbit. The Awami League, which celebrated its 75th anniversary in June, and a party that has been a part of democratic movements from even before Bangladesh's independence, the leading party in Bangladesh's liberation war, seemed to have lost touch with the people. Over time, Hasina who fits the playbook of a dictator became emotionally detached, unable to empathise with the suffering of people. This detachment manifested itself in increasingly brutal responses to anti-government protests. To maintain control, Hasina, like an isolated authoritarian ruler, often resorted to widespread surveillance and violent crackdowns on dissent. These factors created a feedback loop where her isolation exacerbated paranoia and repressive tendencies, ultimately leading to a more oppressive regime. BEGINNING OF AN END Protests erupted in Bangladesh in early July, when students began agitating against the reintroduction of controversial quotas for government jobs. The movement emerged amid widespread discontent with Hasina's government, which had grown increasingly authoritarian and had badly mismanaged the economy. ""It was Hasina's reaction to the protests that was her downfall. She sealed her fate when she decided to crack down rather than pursue dialogue with protest leaders,"" the Crisis Group said in a report. As demonstrations swelled across the country in mid-July, law enforcement agencies tried but failed to suppress the student-led uprising with the majority of them being young protesters. Police and paramilitary units used ""unnecessary and disproportionate"" force and resorted to extrajudicial killings, a level of political violence rarely seen in Bangladesh since its independence in 1971. Even after the Supreme Court drastically reduced the job quotas on July 21, protests continued to gather steam, advancing new demands, including accountability for the killings and the government's resignation. That showed signs of Hasina's troubles ahead. On August 4, a final, terrible round of bloodshed before the collapse of the government left close to 100 people dead, most of them protesters shot by police and ruling-party members acting as vigilantes. The next day, hundreds of thousands heeded student leaders' calls to march on Dhaka and poured into Shahbagh, defying another curfew. Just six kilometres away, Hasina packed up and fled Gono Bhaban. She found refuge in India, the next-door neighbour."
One month into Hasina’s fall: Students to hold ‘Shaheedi March’ today,"The Anti-Discrimination Students Movement will take out ""Shaheedi March"" across the country today to mark the one month of the fall of the Hasina regime. ""We think it is time to remember those who lost their lives for the cause. That's why tomorrow, a month after the fall of the Sheikh Hasina government [on August 5], we'll commemorate the martyrs with marches across the nation,"" said Sarjis Alam, one of the movement's coordinators, at TSC auditorium yesterday. ""I invite the families of every martyr to the march."" In Dhaka, the procession will begin at Raju Memorial Sculpture at 3:00pm and parade through Nilkhet, New Market, Kalabagan, Dhanmondi, Manik Mia Avenue, Farmgate, Karwan Bazar, Bangla Motor, and Shahbagh before ending at the Central Shaheed Minar. ""We will not celebrate the victory until the human and constitutional rights are restored. We must uphold the spirit of the movement,"" said Sarjis. He asked people to take part spontaneously and speak about the misrule of the last government and their desires from the interim government. Meanwhile, student leaders warned that law enforcement agencies would deal with anyone involved in controversial activities, like extortion and torture. ""We urge the people to hand over anyone attempting to tarnish the spirit of the student movement,"" said Abu Baker Majumder, another coordinator. He announced the formation of a fact-finding committee to identify those who opened fire on protesters during the uprising. On forming their own political party, Abu Baker said they would travel across the country and listen to people's opinion on the matter. Hasnat Abdullah, a key organiser of the movement, said, ""They [the Awami League government] used every state machinery for Awami League's fascism. Over the last 15 years, they made the culture of labelling people 'Jamaat-Shibir' to silence the voices of dissent."" He said the AL made a ""religion"" and ""portrayed Sheikh Mujib as a prophet"".  Hasnat said the AL established a culture in which Sheikh Mujib was beyond criticism and the people and the media had to accept it. He said the media was gagged or controlled by the government. ""A news that is liked by the government is not a news, rather it is merely a press release. We now request journalists to question the authorities."" He said, ""Some people are now taking to the streets with various demands. Why did they not raise any question in the last 15 years? Now we have learnt to question the authorities and we have to keep this up."" Hasnat said the constitution of 1972 was not a national constitution, rather it was AL's constitution. ""We accepted it as the national constitution and through that the Awami League first sowed the seeds of fascism. We have to remain united, so that fascism never returns. Now that we are united, they are trying to create divisions. ""We need to set some principles and values to reorganise the state to make sure that fascism cannot return in any form. We expect a state where the people will not have to take to the streets to realise any demand."""
Hasina must stay silent in India till Bangladesh seeks her extradition: Yunus,"In an interview with Press Trust of India, the Chief Adviser of Bangladesh's interim government, Prof Muhammad Yunus, has made a strong case for former prime minister Sheikh Hasina's return from India to face trial for atrocities she committed in Bangladesh. The interview, conducted last Sunday at the Chief Adviser's official residence in Dhaka and released today, reflects the interim government's commitment to ensuring justice for the people of Bangladesh. ""She has to be brought back, or the people of Bangladesh won't be at peace. The kind of atrocities she has committed must be addressed through a trial here,"" Yunus said. He criticised Hasina's political remarks from India, calling them an ""unfriendly gesture"" that causes discomfort in both countries. ""If India wants to keep her until the time Bangladesh (government) wants her back, the condition would be that she has to keep quiet,"" PTI quoted Yunus as saying. ""No one is comfortable with her stance there in India because we want her back to try her. She is there in India and at times she is talking, which is problematic. Had she been quiet, we would have forgotten it; people would have also forgotten it as she would have been in her own world. But sitting in India, she is speaking and giving instructions. No one likes it,"" he said. Yunus was apparently referring to Hasina's statement on August 13 in which she demanded ""justice"", saying those involved in recent ""terror acts"", killings and vandalism must be investigated, identified and punished. ""It is not good for us or for India. There is discomfort regarding it,"" he said. Asked whether Bangladesh has communicated its stance to India, Yunus said it has been conveyed verbally and quite firmly that she should keep quiet. ""Everyone understands it. We have said quite firmly that she should keep quiet. This is an unfriendly gesture towards us; she has been given shelter there and she is campaigning from there. It is not that she has gone there on a normal course. She has fled following a people's uprising and public anger,"" he said. Yunus said that while Bangladesh values strong ties with India, New Delhi must move ""beyond the narrative that portrays every other political party except Awami League as Islamist and that the country will turn into Afghanistan without Sheikh Hasina."" ""The way forward is for India to come out of the narrative. The narrative is that everybody is Islamist, the Bangladesh Nationalist Party (BNP) is Islamist, and everyone else is Islamist and will make this country into Afghanistan. And Bangladesh is in safe hands with Sheikh Hasina at the helm only. India is captivated by this narrative. India needs to come out of this narrative. Bangladesh, like any other nation, is another neighbour,"" he said. Referring to the recent incidents of attacks on Hindu minorities in Bangladesh and India flagging concerns about it, Yunus said this is just an ""excuse"". ""The issue of trying to portray the conditions of minorities in such a big way is just an excuse,"" he said. Asked about ways to improve the India-Bangla relations, Yunus said both the countries need to work together and it is on a downhill presently. ""We need to work together to improve this relationship, which is now at a low,"" he said. Speaking about the future of bilateral treaties with India, Yunus said there are demands for a relook at certain treaties such as transit and the Adani power deal. ""Everybody is saying that it is needed. We will see what is on paper and, second, what is actually happening on the ground. I can't answer it specifically. If there is any need to review, we will then raise questions about it,"" he said."
One month of Hasina's fall: 'Shaheedi March' begins from Raju Sculpture,"The Anti-Discrimination Student Movement has started the ""Shaheedi March"" to mark one month of the fall of the Sheikh Hasina regime. Students from various institutions, including Dhaka University (DU), gathered at the Raju Memorial Sculpture and began the march at 4:00pm.   
The event has drawn participation from both students and members of the public from various walks of life.



 







Photo: Palash Khan
The rally, organised by the Anti-Discrimination Student Movement, was announced yesterday and was set to begin at 3:00pm today.











Read moreShaheedi March: Roads to avoid today
Participants, arriving in groups from various educational institutions, with flags and placards in hands.
  
As per the schedule, the procession will begin at Raju Memorial Sculpture, moving through key points in the capital including Nilkhet, New Market, Kalabagan, Dhanmondi, Manik Mia Avenue, Farmgate, Karwan Bazar, Bangla Motor, and Shahbagh, before concluding at the Central Shaheed Minar.



  The event has drawn participation from both students and members of the public from various walks of life.  







Photo: Palash Khan
The rally, organised by the Anti-Discrimination Student Movement, was announced yesterday and was set to begin at 3:00pm today.











Read moreShaheedi March: Roads to avoid today
Participants, arriving in groups from various educational institutions, with flags and placards in hands.
  
As per the schedule, the procession will begin at Raju Memorial Sculpture, moving through key points in the capital including Nilkhet, New Market, Kalabagan, Dhanmondi, Manik Mia Avenue, Farmgate, Karwan Bazar, Bangla Motor, and Shahbagh, before concluding at the Central Shaheed Minar.



  The rally, organised by the Anti-Discrimination Student Movement, was announced yesterday and was set to begin at 3:00pm today. Participants, arriving in groups from various educational institutions, with flags and placards in hands.   
As per the schedule, the procession will begin at Raju Memorial Sculpture, moving through key points in the capital including Nilkhet, New Market, Kalabagan, Dhanmondi, Manik Mia Avenue, Farmgate, Karwan Bazar, Bangla Motor, and Shahbagh, before concluding at the Central Shaheed Minar.



  As per the schedule, the procession will begin at Raju Memorial Sculpture, moving through key points in the capital including Nilkhet, New Market, Kalabagan, Dhanmondi, Manik Mia Avenue, Farmgate, Karwan Bazar, Bangla Motor, and Shahbagh, before concluding at the Central Shaheed Minar."
