headline,body
Nahid Islam wants Hasina to face trial,"A Bangladeshi student leader who was instrumental in overthrowing Sheikh Hasina and is now part of an interim government said she must face trial when she returns home as planned for the killings during her term, including during recent protests, which led her to resign and flee on Monday. About 300 people, many of them university and college students, were killed in the demonstrations that began in July with students demonstrating against quotas in government jobs before spiralling into violent protests to oust Hasina, who had ruled Bangladesh for 20 of the last 30 years. Hasina's son Sajeeb Wazed Joy has said she will return to Bangladesh from India, where she is sheltering, once elections are announced in her home country, which the main opposition has demanded should be held in three months. ""I am curious why she fled the country,"" student leader Nahid Islam, who is effectively a minister in the interim government, told Reuters late on Friday in his first interview since joining the government on Thursday as an adviser. ""We will seek justice for all the killings that happened under her, that has been one of the main demands of our revolution. Even if she does not come back, we will work towards that."" ""We want to arrest her - whether that will work through the regular judicial system or a special tribunal on that or not, we are discussing how to proceed on the matter,"" said Islam, 26, who now heads the postal, telecommunication and information technology ministries. Joy, who is based in the United States, did not respond to a request seeking comment. Hasina, who is under the protection of the Indian government, could not be contacted. Another student leader, Abu Baker Mojumder, separately told Reuters they want Hasina to return and face trial. Islam said one of the caretaker government's main priorities was to hold a free and fair election, after the last election was boycotted by the opposition, and also investigate suspected corruption in the previous government. Islam said Bangladesh would need electoral and constitutional reforms before any election, so it was not clear when the next vote would be held. He declined to give a specific timeline. ""My ambition on what I next become depends on the people of Bangladesh,"" he said when asked whether one day he would like to be prime minister. He said India had fostered a relationship with Hasina's Awami League party, but not the people of Bangladesh as a whole. ""We want friendly ties with India,"" he said. ""India also needs to look at its foreign policy, else it will become a problem for the whole of South Asia."""
Try Hasina in int’l crimes tribunal,"Leaders of the students against discrimination platform yesterday demanded that the government file a case against former prime minister Sheikh Hasina and her associates in the International Crimes Tribunal for ""killing students and people"". They came up with the demand at a protest rally organised at the base of Raju Memorial Sculpture on the Dhaka University campus. They also demanded a ban on organisation-based student politics on all campuses, citing various terrorist activities of Chhatra League in the educational institutions. Criticising the advisers of the interim government, coordinator Hasnat Abdullah said, ""We had seen the advisers talking about rehabilitating the murderers [Sheikh Hasina and other AL leaders]. We want to remind these advisers that you have come to power through the student-people uprising."" ""We will not hesitate to oust you just the way we made you advisers,"" he warned. Hasnat also said those who want to rehabilitate AL in this country will be resisted by the students and people. Addressing the media, he said, ""We have a cordial relationship with the media. The role of media in making our movement global is undeniable. But we can see that some media are trying to rehabilitate those fallen. We urge the media to realise the people's pulse."" Speaking at the event, Akhter Hossen, former social welfare secretary of Dhaka University Central Students' Union and convener of Gonotantrik Chhatra Shakti, said, ""Sheikh Hasina has fled the country but is still hatching various conspiracies while sitting abroad."" He also asked the students to get prepared to protect the minorities."
‘Has Hasina fallen yet?’,"A 24-year-old was fatally shot in Dhaka's Laxmibazar. A 10th-grader was gunned down in a similar manner in Savar. A 20-year-old was shot in the chest in Narayanganj. At least 400 lives (the actual number could be much higher) were lost when law enforcers opened fire on protesters during the recent unrest. But these victims are not just statistics; they are children, parents, and friends. In this report, we try to know the stories of three such names among these tragic numbers.   Abul Hossain Sajan, 20, had just regained consciousness lying in the Intensive Care Unit of Dhaka Medical College Hospital after a seven-hour-long surgery at 3:00am on August 6. Finding his elder brother Md Anik, beside the bed, he asked, ""Has the Hasina-government fallen yet?"" ""It irked me a bit and I told him to rest. He had just gone through a critical surgery to remove a bullet that hit him in his chest the day before,"" Anik said. ""Leaving Sajan inside the ICU to let him rest and recuperate, I went out and found out that Sheikh Hasina had resigned and fled."" ""Half-an-hour later, I went back to Sajan and told him that Shaikh Hasina had resigned. My brother smiled as I told him this, and he closed his eyes. I thought he went back to sleep, but after some time, the on-duty doctor checked on him and said he was gone…"" Anik also said. ""My brother died in peace knowing that the dictator was gone,"" he added. Abul Hossain Sajan, a 20-year-old from Kushiara village in Narayanganj, had been a committed participant in the ongoing student protests against the government. Despite the risks, he joined the movement alongside his elder brother, Md Anik, on August 5. Their destination was Chashara Intersection, where they planned to join others in the ""March to Dhaka"" event, organised by the Anti-discriminatory Students' Movement. As they approached the intersection, the group of 11 protestors was ambushed by a mob of 50-60 men, believed to be Awami League supporters. Armed with firearms and sharp weapons, the attackers chased and fired at the protesters. In the chaos, Sajan became separated from his brother and was struck by a bullet in his chest. Sajan was initially rushed to Narayanganj General Hospital before being transferred to Dhaka Medical College Hospital , Sajan completed his HSC in 2022 but could not continue studying as his father Jakir Hossain passed away. He went on to join a soft drink manufacturing company as a sales representative, and eventually took the entire responsibility of the family after his elder brother became unemployed six months back. Meanwhile, Anik has filed a case accusing former prime minister Sheikh Hasina, along with former home minister Asaduzzaman Khan and 46 others over his brother's death. Former MP AKM Shamim Osman, his brother former MP AKM Selim Osman, son Imtinan Osman Ayon, nephew Azmery Osman were also among the accused."
Hasina faces 5 more cases,"Former prime minister Sheikh Hasina was accused in five more cases yesterday. Four of the cases were filed in Dhaka over the killing of four people during the recent student-led movement, while another was filed in Rajshahi over the abduction and torture of a BNP leader in 2023. With this, Hasina is now facing 71 cases, including 60 for murder, seven for crimes against humanity and genocide, three for abduction, and one for attack on a BNP procession. Hasina and 48 others were sued for the killing of one Dulal alias Selim in the city's Jatrabari area on August 3. The victim's brother Mostafa Kamal filed the case with the court of Dhaka Metropolitan Magistrate Md Saddam Hossain. Former home minister Asaduzzaman Khan, AL General Secretary Obaidul Quader, former AL lawmakers Shamim Osman and Ramesh Chandra are among the accused. The magistrate recorded the statement and asked the officer-in-charge of Jatrabari Police Station to register it as a First Information Report (FIR). In Mohammadpur, Hasina and 21 others were sued for the killing of Mansur Miah, a machine operator at Buriganga Filling Station in Bosila on July 19. The victim's brother Ainal Haque filed the case with a Dhaka court which asked the Mohammadpur Police OC to register it as an FIR. Quader, Asaduzzaman, former AL lawmakers Ali Arafat and Jahangir Kabir Nanak, former inspector general of police Chowdhury Abdullah Al-Mamun, former DB chief Harun Or Rashid and former DMP commissioner Habibur Rahman are among the accused in the case. Khorshed Alam brother of Miraz Hossain, who was killed on August 5, filed another case against Hasina and 91 others with the court of Dhaka Metropolitan Magistrate Belal Hossain. The magistrate recorded his statement and asked the Demra Police OC to register it as an FIR. Hasina and 40 others were sued for the killing of 21-year-old Nahidul Islam at Mirpur-10 on July 19. The victim's brother Md Sabuj filed the case with a Dhaka court, which asked Mirpur Police OC to register it as an FIR. Hasina' sister Sheikh Rehana and son Sajeeb Wazed Joy are among the accused. In Rajshahi, SM Salahuddin Ahmmed Shamim Sarkar, convenor of Bagha upazila Chhatra Dal, filed a case against Hasina, former state minister for foreign affairs Shahriar Alam, and 52 others on charges of abduction and torture, said Bagha Police OC Abu Siddque. According to the case statement, under the direct instruction of Hasina and the other accused, Salahuddin was picked up in front of the Bagha New Bus Stand on May 21, 2023. He was tortured and shot in the leg before being handed over to the police, who later framed him in a false case, Salahuddin mentioned in the case."
Four more cases filed against Hasina,"Former prime minister Sheikh Hasina has been sued in four more cases over the killings of three people and the attempted murder of another person during the student-led mass uprising. Three of the cases were filed with Dhaka courts yesterday while another murder case was filed in Bogura two days ago. Several former ministers, including Awami League General Secretary Obaidul Quader, Asaduzzaman Khan, top police officers and at least three journalists, were among the accused. With these, Hasina is now facing 75 cases related to the protests, including 63 on murder charges, seven on allegations of crimes against humanity and genocide, three on charges of abduction, and two for other charges. Hasina and 30 others were sued over the death of grocery shop owner Mizanur Rahman during the quota reform movement in the capital's Banasree on July 19. His father Kamal Hossain filed the murder case with the court of Additional Chief Metropolitan Magistrate Md Tofazzal Hossain who asked Khilgaon Police Station to register it as a first information report (FIR). The court asked the OC of the same police station to register an FIR over the death of 14-year-old Ashiqul Islam on the same day. Hasina and 26 others were accused in the case filed by Ashiqul's mother Arisha Afroz. The third case was filed against Hasina and 50 others on charges related to the attempted murder of a lawyer of the Dhaka Bar Association during the students' quota reform protest on July 18. Advocate Abdul Baset Shamim filed the case with the court of Additional Chief Metropolitan Magistrate Md Tofazzal Hossain. The magistrate asked Mugda Police Station's OC to register the complainant's statement as an FIR. In Bogura, Hasina, three local journalists and 130 others were sued in a murder case over the death of Md Shaheed, 35, who was shot dead on August 4, a day before Hasina's fall. Shimu Begum, 34, the wife of the deceased, filed the case on Tuesday, said Bogura Sadar Police Station OC Saihan Olliullah."
"2 more murder cases against Hasina, Quader in Gazipur","Two murder cases were filed yesterday against former prime minister Sheikh Hasina, Awami League General Secretary Obaidul Quader, and former home minister Asaduzzaman Khan Kamal in Gazipur. Six people were killed during a clash between protesters and BGB members and Awami League leaders and activists in Sreepur upazila. Relatives of two victims filed the cases with Sreepur Police Station last night, the police station's Officer-in-Charge KM Sohel Rana told The Daily Star. Jamal Uddin, father of deceased Zakir Hossain Rana, 35, resident of Kapatiapara area of ​​Sreepur, and Munju Mia, father of deceased Rahmat Mia, 20, of Sariakandi police station of Bogra district filed two cases. Former liberation war affairs minister AKM Mozammel Haque, Awami League Organising Secretary Mirza Azam, former IGP Chowdhury Abdullah Al Mamun, former DMP Commissioner Habibur Rahman, former DB chief Harun-or-Rashid, Gazipur Metropolitan Awami League President Azmat Ulla Khan, former Gazipur City Mayor Jahangir Alam were made accused in the case. Apart from the 97 named accused, 1,100 people were made unnamed accused, the OC said. Hasina is now facing 77 cases related to the protests, including 65 on murder charges, seven on allegations of crimes against humanity and genocide, three on charges of abduction, and two for other charges."
"Student protests: Hasina, Rehana, S Alam sued over worker’s killing","Former prime minister Sheikh Hasina and S Alam Group Chairman Mohammed Saiful Alam have been accused in a case over the death of a garment factory worker in Dhaka during the recent uprising. Hasina's sister Sheikh Rehana, cricketer and ex-MP Shakib Al Hasan, Saiful's sons Ahsanul Alam and Ashraful Alam, former home minister Asaduzzaman Khan, former state minister for information Mohammad A Arafat, and former Dhaka South mayor Sheikh Fazle Noor Taposh were also named in the case. Victim Md Rubel's father Rafiqul Islam filed the case at Adabor Police Station on Thursday, Inspector (Investigation) Mintu Chandra Banik told The Daily Star yesterday. Other accused include AL leaders Amir Hossain Amu and Jahangir Kabir Nanak, JaSad President Hasanul Haq Inu, Workers Party President Rashed Khan Menon, Tarikat Federation President Syed Nazibul Bashar Maizvandary, Samyabadi Dal General Secretary Dilip Barua, and Jatiya Party (JP) President Anwar Hossain Manju. The former and current police officers named in the case include ex-IGP Chowdhury Abdullah Al-Mamun, ex-RAB DG Haroon-ur-Rashid, former DMP chief Habibur Rahman and former DB chief Harunor Rashid. About 500 more unidentified people were also accused in the case. According to the case documents, Rubel was shot on direct and indirect orders from the accused when he took part in a procession on Ring Road on August 5. He was rushed to the hospital with bullets in his chest and stomach. He died on August 7. Hasina is also facing charges of ordering the killing of Dhaka Commerce College student Abdul Ahad Saikat in Savar. His father Nazrul Islam also accused 126 others in the case yesterday, Savar Model Police Station OC Atiqur Rahman said. The other accused include AL General Secretary Obaidul Quader, ex-minister Asaduzzaman, former state minister Arafat, and former state minister for disaster management Enamur Rahman. According to the case details, they ordered the Chhatra League, Jubo League, and Awami League members to carry out the attack. Nazrul said in the case that his son was killed when he participated in the student-led mass uprising against ""systematic inequalities"" on August 5, the day Hasina resigned and fled. According to the case dossier, Saikat was brutally beaten and shot on Mukti Road. He was declared dead upon arrival at the hospital. OC Atiqur said they were investigating the incident. Another case was filed at the same police station over the death of Malaysian expatriate Shraban Gazi, 20. Shraban's father Mannan Gazi filed the case against 85 AL leaders and activists, including Quader, Asaduzzaman, Arafat, and Enamur. Protest victims' families filed nine other murder cases against AL leaders in different parts of the country, including five in Ashulia and three in Sirajganj. The Ashulia victims were meat seller Lebu, 20, Maulana Sadiqur Rahman, Tanzil Ahmed Sujoy, Class VIII student Arafat Munshi, and BNP activist Mamun Khandkar. All of them were shot dead in the Baipile area on August 5. Their family members named a total of 78 people and around 1,200 unidentified individuals in the cases. In Sirajganj, ex-MPs Jannat Ara Henry, Millat Munna, former cabinet secretary Kabir Bin Anwar, and 461 AL men were sued in three cases on charges of killing three BNP men – Md Ronju Sheikh, a joint convener of Sirajganj district Jubo Dal, Jubo Dal activist Abdul Latif and Chhatra Dal activist Sumon Sheikh. Their family members filed the cases at Sirajganj Sadar Police Station on Thursday night, OC Md Humayun Kabir said. In Dhamrai, former Dhaka-20 MP Benjir Ahmed and 81 others were sued over the death of Ariful Islam Sader, 18, a student of Savar Cantonment Public College, by his father Azim Uddin. In Barishal, the accused in a case over vandalising and looting the BNP office include former state minister for water resources Zahid Farooq, and former city corporation mayors Abul Khair Abdullah and Serniabat Sadiq Abdullah."
"Case filed against Hasina, Quader, Asaduzzaman over killing university student","Former prime minister Sheikh Hasina and 48 others were sued today in a case filed over the death of university student Sheikh Ashabul Yamin at Savar Bazar bus stand during the quota reform movement on July 18. Yamin was a student of Military Institute of Science and Technology (MIST) in Mirpur. The victim's uncle Abdullah Al Kabir filed the case with the court of Dhaka Senior Judicial Magistrate Md Saiful Islam against 49 people including Hasina, former road transport and bridges minister Obaidul Quader, and former home minister Asaduzzaman Khan. Former AL lawmaker Saiful Islam, former inspector general of police Chowdhury Abdullah Al-Mamun and Savar Police Station OC Md Shahjahan are among the accused. After the hearing, Judge Md Saiful asked the officer-in-charge of Savar Model Police Station to register the case as a first information report (FIR). The complainant in the case said his nephew Yamin was killed around 1:30pm on July 18 at Savar Bazar bus stand during a clash between quota protesters on one side and police and activists of AL and its associate bodies on the other. More than 50 cases were filed so far against Hasina, her party members and law enforcement officers over the killings during the protests."
Hasina urges all to stand by flood victims,"Awami League president Sheikh Hasina today urged countrymen to stand beside the flood-affected people. She also called upon leaders, activists and supporters of her party and its front and associate bodies and people of different sociocultural backgrounds and professions to get united to extend their support to the flood victims. Expressing deep concerns over the recent floods, Hasina said that the flood has suddenly taken a serious turn in some south-eastern districts of the country. Hasina, the immediate-past prime minister of the country who resigned and fled to India in face of a student-led movement, said she had directed all to take preparation in early July to tackle a severe flood. ""Earlier, we successfully helped the flood victims and handled the post-flood situation as leaders and activists of Awami league and its associate bodies came forward,"" she stated. Sheikh Hasina expressed deepest condolences for those died in current flood and urged the family members of the victims to have patience. The statement, signed by AL office secretary Biplab Barua, was uploaded to AL's verified Facebook page."
Hasina made accused in 12 more cases,"Former prime minister Sheikh Hasina was accused in 12 more cases filed in Dhaka and elsewhere yesterday. Ten of these cases were filed over killings that took place during the recent student protest. Besides, a case was filed over the death of a former official of the then Bangladesh Rifles (BDR) in 2010 while the father of a victim of enforced disappearance filed an abduction case. Hasina is now facing 64 cases, including 54 for murder, seven for crimes against humanity and genocide, two for abduction, and one for attack on BNP procession. Former Awami League ministers Obaidul Quader, Asaduzzaman Khan Kamal, Anisul Huq, and Jahangir Kabir Nanak, and former inspector general of police Chowdhury Abdullah Al-Mamun are among the accused in the cases. Hasina, former army chief Aziz Ahmed, and 11 others were sued yesterday over the death of Abdur Rahim, the former deputy director of BDR in 2010. Rahim, an accused in the BDR carnage case, died in jail on July 29 of that year. Advocate Abdul Aziz, son of deceased Abdur Rahim, filed the case with the court of Dhaka Metropolitan Magistrate Md Akhtaruzzaman. Mosharraf Hossain Kajol, the then public prosecutor of the BDR mutiny case, and former lawmakers Sheikh Fazle Noor Taposh, Sheikh Fazlul Karim Selim, Sheikh Helal, and Mirza Azam are among the accused in the case. Hasina and 48 others were sued in a case filed over the death of university student Sheikh Ashabul Yamin at the Savar Bazar bus stand during the quota reform movement on July 18. The victim's uncle, Abdullah Al Kabir, filed the case with a Dhaka court. In a viral video, Yamin, a student of the Military Institute of Science and Technology (MIST), was seen being dropped on the road by the law enforcers from their armoured van. He was still alive at the time. One Masud Rana filed a case with another Dhaka court against Hasina and 24 others over the death of his brother-in-law, Babu Mollah, in the Hatirjheel area on July 19. Hasina and 21 others were sued over the death of Golam Nafiz, 17, at the Farmgate area of Tejgaon on August 1. Rafiqul Islam filed a case with the court of Dhaka Metropolitan Magistrate Mohammad Nurul Huda Chowdhury. Nasir Uddin filed a case with a Dhaka court against Hasina and 18 others over the death of shop employee Jasim Uddin, 35, in the Uttara Paschim area on July 18. Upon separate hearings, the four magistrates recorded the statements of the complainants and asked the officer-in-charges (OC) of the police stations concerned to register the complaints as the First Information Report (FIR). Yesterday, Rizia Begum, 36, filed a case with the court of Dhaka Metropolitan Magistrate Saddam Hossain against Hasina and 33 others over the death of his nephew journalist Mehedi Hasan near the Kazla Toll Plaza over Hanif Flyover in Jatrabari during quota protests on July 18. Babul Mia, 42, also filed a case with the court of the same magistrate over the death of one Jisan against Hasina and 26 in Matuail on July 20, while Mamunur Rashid, 34, filed a case against Hasina and 27 others over the death of his brother-in-law Yusuf Mia Sanoar in Shani Akhra area on July 20. Another case was filed against Hasina and 13 others over the death of Mahamudur Rahman Soikot, 19, in Mohammadpur on July 19. Besides, 30-40 unnamed police officers and members were also accused. In Narsingdi, Angur Mia, the brother-in-law of the slain Jaman Mia, filed a murder case against Hasina and two others with a local court. The court directed the Madhabdi Police Station officer-in-charge to record it as an FIR. Local Awami League leaders and activists, at the behest of the named accused, opened fire on a peaceful student protest on July 21. Jaman was shot while overseeing the protest and later succumbed to his injuries on July 25 at Dhaka Medical College Hospital. In Rangpur, a murder case has been filed against 150 individuals, including Hasina and her sister, Sheikh Rehana, with a local court over a clash between student protesters and law enforcement agencies during a student movement in Rangpur on July 19. A shop worker, Momdel Hossain, who was forced to amputate his left leg from the knee, filed the case. The court asked Kotwali Police Station to record it as an FIR. In Pirojpur court, Hasina and 13 others, including five Rab members, were sued in an abduction case filed by Babul Hawlader, father of Sunny Hawlader, who was a victim of enforced disappearance in 2013. The then Rab director general Mokhlesur Rahman was among the accused."
