headline,body
Hasina’s ouster grabs global headlines,"The ouster of the Sheikh Hasina-led government dominated the international media yesterday. Hasina's 15-year rule ended today as she fled weeks of deadly protests and the military announced it would form an interim government. Army chief General Waker-Uz-Zaman said in a broadcast to the nation on state television that Hasina had resigned and the military would form an interim government. International media reports said Hasina, 76, was flown in a military helicopter with her sister and was headed to India. The CNN News 18 television channel, an Indian TV station, said she had landed in Agartala, the capital of India's northeastern state of Tripura, across the eastern border of Bangladesh. However, other Indian media reported that the ousted PM landed in Delhi at 5:36pm at the Hindon Air Base in Ghaziabad where she was received by Air Force officials. Several Indian media, where the news dominated all through the day, reported that she might fly to London. Several news outlets including BBC also reported widespread looting and arson across the country since the ouster. News agencies Reuters and AFP ran several articles on the developments that took place before and after the ouster. According to AFP, security forces, who had supported Hasina's government throughout the unrest, did not intervene to stem Sunday's protests which claimed at least 94 lives. It said, with Sunday's deaths, the total toll of the violence that began in early July over the quota reform protest is now at least 300. It also showed images of crowds running into the Gono Bhaban, the official residence of Hasina as PM, waving to the camera as they celebrated, looting furniture and books, with others relaxing on beds. Others smashed a statue of Hasina's father Sheikh Mujibur Rahman, the country's independence hero. Michael Kugelman, director of the South Asia Institute at the Washington-based Wilson Center, told AFP that Hasina's departure ""would leave a major vacuum"". ""If it's a peaceful transition, with an interim set-up taking over until elections are held, then stability risks would be modest and the consequences would be limited,"" he said. ""But if there is a violent transition or a period of uncertainty, that could risk more destabilisation and problems inside and outside."" According to a Reuters report, Army chief Zaman said he had held ""fruitful"" talks with leaders of all major political parties he had ""invited"" and would soon meet President Mohammed Shahabuddin to discuss the way ahead. He also urged ""a little time"" to ensure peace and stability. However, some of the crowd, who thronged the Gono Bhaban, were seen carrying away televisions, chairs and tables from what was one of the most protected buildings in the country. CNN also reported on the development with a long article. ""Whatever demands you have, we will fulfil and bring back peace to the nation, please help us in this, stay away from violence,"" it quoted the army chief as saying. ""The military will not fire at anyone, the police will not fire at anyone, I have given orders,"" the army chief added as per the report. The ouster of Sheikh Hasina was the lead news on BBC's website. Besides describing the jubilation after the ouster and the bloodshed before it, quoting BBC Bangla, it reported about widespread looting in Dhaka. Besides the Gono Bhaban, it also reported on attacks on Asaduzzaman Khan, the home minister of the ousted government, in the Dhanmondi area of the capital. Quoting Lutfey Siddiqi, a visiting professor-in-practice at the London School of Economics, BBC also reported on the ""inevitable"" economic crisis the country faces. ""Sheikh Hasina's government appears to have lost both the right and might to govern. Soon it will run out of the resources to do so as well,"" Siddiqi told the BBC. ""Bangladesh is on the verge of an economic implosion."" India Today said Bangladesh was engulfed in political uncertainty with the resignation of Sheikh Hasina. It also showed short clips of people who stormed the Gono Bhaban. NDTV ran several news on the developments. In its lead piece titled ""Bangladesh PM Sheikh Hasina Quits, Army Coup Amid Massive Protests"", it said Hasina landed at Hindon airbase near Delhi after ""fleeing Bangladesh"". The Hindu said Hasina ""succumbed to the protest"" and tendered her resignation. The report said Hasina had taken shelter in India before, but ""this time it was not a coup"" as it reported widespread anger over the recent violence. The Dawn, Pakistan's leading news outlet, ran the development as a lead. It said, ""Bangladesh's army chief will form an interim government after Prime Minister Sheikh Hasina resigned and fled Dhaka in the face of overwhelming protests"" Xinhua, the official state news agency of the People's Republic of China, ran a five-paragraph news on the development titled ""Bangladesh PM resigns, interim government to run country: army chief"". The Indian Express ran an article titled ""From longest-serving PM of Bangladesh to fleeing the country: The rise and fall of Sheikh Hasina"" alongside several others detailing the current developments and more. Calling her ""the world's longest-serving female head of government"", the news outlet said, ""Hasina's opponents have constantly accused her of growing increasingly autocratic and called her a threat to the country's democracy."""
Hasina may be on way to London via India: diplomatic sources,"Sheikh Hasina, who resigned as Bangladesh Prime Minister earlier today following unprecedented anti-government protests, may be on her way to London through India, multiple diplomatic sources in India said. Hasina is learnt to be travelling in a C130J transport aircraft of the Bangladesh Air Force and it is expected to have a stopover in India, India's civil aviation sources said. It is not immediately clear whether the military transport aircraft will take her beyond India or she will travel to London in a different plane. The military plane, the most tracked plane today on website Flight Radar 24 which tracks the flight of all planes, was expected to land in Hindon Air Base near Delhi around 6:00pm Indian time."
"Arrest, send back Hasina, Rehana: SCBA president urges India ","The Supreme Court Bar Association (SCBA) President AM Mahbub Uddin Khokon today called on India to arrest former prime minister Sheikh Hasina and her sister Sheikh Rehana, and send them back to Bangladesh. ""We want to maintain a good relationship with the people of India. Please, arrest Sheikh Hasina and Sheikh Rehana, who fled the country, and send them back to Bangladesh. Sheikh Hasina has killed many people in Bangladesh,"" he said. Barrister Khokon, who is also a joint secretary general of the BNP, urged the authorities not to declare a state of emergency. ""There is talk of issuing a state of emergency. We don't want a government like that of Moeen U Ahmed and Fakhruddin Ahmed. No one, including the students, wants the state of emergency. They will not accept it and will protest if any initiative is taken to issue it,"" he said during a press conference at the SCBA auditorium, where several pro-BNP lawyers were present. The SCBA president demanded that Supreme Court judges who have engaged in politics and corruption resign within one week. ""Many judges have ordered the remand of BNP men and sentenced them in false cases, breaking their oaths and being overly enthusiastic. HC judges have acquitted Awami League leader Mofazzal Hossain in a case filed for amassing illegal wealth, while BNP leaders Iqbal Hassan Mahmud Tuku and Aman Ullah Aman were imprisoned in similar cases. Judges who have judged politically, breaking their oaths, are unfit to remain as judges. They have no right to stay in their positions. I request them to resign within a week. We will disclose their names if they don't step down,"" he said. He also demanded resignations of the state law officers including Attorney General AM Amin Uddin, and the chiefs and officials of the Anti-Corruption Commission (ACC) and National Human Rights Commission (NHRC) within a week as they were appointed by the Sheikh Hasina-led government. Khokon said many political prisoners, who have been suffering in jails, must be released immediately. ""The president has said that they will be released on bail. They must not only be granted bail, but the cases filed against them should also be withdrawn by executive order of the government under Section 494 of the Criminal Procedure Code,"" he said. Additionally, the Jatiotabadi Ainjibi Forum, a body of pro-BNP lawyers, led by its President Zainul Abedin and Secretary General Kayser Kamal, organized a meeting and held a procession at the SCBA premises to celebrate the success of the movement against the Sheikh Hasina-led government."
Hasina will return to Bangladesh the moment elections are announced: Joy,"Sheikh Hasina will come back to Bangladesh as soon as the interim government decides to hold an election, said the former prime minister's son Sajeeb Wazed Joy in an interview with Times of India yesterday. ""For the time being, she is in India. She will go back to Bangladesh the moment the interim government decides to hold an election. I am thankful to PM Narendra Modi for saving my mother's life at such short notice."" Sheikh Hasina resigned as prime minister and fled Bangladesh on August 5, when a student-led protest culminated in a mass uprising against her Awami League government. More than 400 people were killed in the preceding three weeks, a majority of them in police firing and firing by Awami League activists. Stating that the Awami League leaders were still allegedly under attack in Bangladesh, Joy said, ""I will do whatever it takes to save the party and its workers. If there is a need for me to join politics, I will not refrain from that. My mother would have retired from politics after the current term. I never had any political ambition and was settled in the US. ""But the developments in Bangladesh in the past few days show that there is a leadership vacuum. I had to get active for the sake of the party and I am at the forefront now."" While more than 140 people were killed in the mob violence and rioting on August 5 following Hasina's fleeing, the violence has reduced markedly since then as the students have been on the streets in the absence of law enforcement. The security forces have also become active amid reports of looting at night. There have also been attacks on members of the Hindu community, especially outside Dhaka. Joy's statements came after Khaleda Zia's son Tarique Rahman, the Bangladesh Nationalist Party's acting chairman, is returning to Dhaka following his exile from Bangladesh. Speaking right after the new interim government led by Nobel Laureate Muhammad Yunus took charge of Bangladesh, Joy said, ""I am sure the Awami League will take part in the election and we might even win. We have the largest supporter base in Bangladesh."" He also claimed that his mother (Hasina) has no plans for seeking asylum in any country. Joy stressed there was a need for ""introspection"". ""There definitely were 'mistakes'. When you run a country, a lot of decisions are made every day. Awami League believes in introspection and we were ready for that. But we did not get a chance to do that this time. We never realised the situation would escalate so fast,"" Joy said. He also said an alliance of BNP and Jamaat-e-Islami will not be able to save the minorities. ""If the Awami League is not in power, the eastern border of India will not be secure. If there is an alliance of BNP and Jamaat, that may not be good for India as Jamaat will not refrain from militancy,"" Joy said, requesting India to mount pressure on Bangladesh to hold elections soon. The Awami League government, during its 15 years in power, and Hasina herself was sharply critical of any political opponent or civil society member calling for foreign pressure in domestic policies. Joy's comments come after he had earlier in the week said that his family were ""done with politics""."
'Hasina likely to stay in India until UK grants asylum',"Former Bangladeshi prime minister Sheikh Hasina is likely to stay in India until the UK grants her asylum, reports Republic TV. It said that India is likely to provide Hasina all logistical support, reports our New Delhi correspondent quoting the TV channel. 







Read moreAjit Doval meets Hasina at Hindon Air Base near Delhi
Meanwhile, Indian Air Force and other Indian security agencies are providing security to Hasina who is being moved to a safe location, ANI said quoting unnamed sources.



Hasina is likely to meet her daughter Saima Wazed, who is based in New Delhi and working as the World Health Organisation's regional director for South-East Asia.











Read moreHasina lands in Hindon Air Base in India's UP
Security at the Bangladesh High Commission in New Delhi's diplomatic zone Chanakyapuri has been beefed up with the installation of additional barricades and deployment of more police forces.
Prime Minister Narendra Modi tonight presided over a high-level meeting of the cabinet committee on security affairs.








Read morePM resigned, interim govt to be formed:  Army chief
However, there was no official word on what transpired at the meeting which ended around 8:30pm IST.



  Meanwhile, Indian Air Force and other Indian security agencies are providing security to Hasina who is being moved to a safe location, ANI said quoting unnamed sources. Hasina is likely to meet her daughter Saima Wazed, who is based in New Delhi and working as the World Health Organisation's regional director for South-East Asia. 







Read moreHasina lands in Hindon Air Base in India's UP
Security at the Bangladesh High Commission in New Delhi's diplomatic zone Chanakyapuri has been beefed up with the installation of additional barricades and deployment of more police forces.
Prime Minister Narendra Modi tonight presided over a high-level meeting of the cabinet committee on security affairs.








Read morePM resigned, interim govt to be formed:  Army chief
However, there was no official word on what transpired at the meeting which ended around 8:30pm IST.



  Security at the Bangladesh High Commission in New Delhi's diplomatic zone Chanakyapuri has been beefed up with the installation of additional barricades and deployment of more police forces. Prime Minister Narendra Modi tonight presided over a high-level meeting of the cabinet committee on security affairs. 







Read morePM resigned, interim govt to be formed:  Army chief
However, there was no official word on what transpired at the meeting which ended around 8:30pm IST.



  However, there was no official word on what transpired at the meeting which ended around 8:30pm IST."
