headline,body
"Hasina, Natore Ex MP Shimul sued for murder of student","Former prime minister Sheikh Hasina, former Natore lawmaker Shafiqul Islam Shimul and 109 others have been sued for the murder of schoolboy Yasin Islam in the district during the Anti-Discrimination Student Movement on August 5. Victim Yasin Islam's father Fajer Ali Ezahar filed the case with Natore Sadar Police Station, said Md Mizanur Rahman, officer-in-charge (OC) of Natore Sadar Police Station. Sirajul Islam, president of Natore district unit AL, and Md Shariful Islam Romzan, general secretary of Natore district unit AL were also among the 111 accused, reports our Natore correspondent. In the case statement, Fajer said his son Yasin joined the anti-discrimination student movement in Natore. On the morning of August 4, when Yasin along with others were protesting in the madrasa moor area of Natore town, former MP Shimul and his followers assaulted Yasin. Later, they picked him up and confined him in a room of Shimul's house in Kandivita. On August 5, when Shimul heard the news that Sheikh Hasina resigned and left the country, he set fire to his own house. Yasin was burnt to death, added the case statement. Yasin's burnt body was found in a room on the second floor of his house the next morning."
"Hasina, Quader, Shamim Osman accused in N'ganj murder case","A murder case was filed against former prime minister Sheikh Hasina and 61 others in Narayanganj early today. Awami League General Secretary Obaidul Quader, former home minister Asaduzzaman Khan Kamal and former lawmaker Shamim Osman were also among the accused. With this, Hasina, who resigned and fled the country amid a mass uprising on August 5, is now facing 16 cases, including 13 for murder, one for abduction, and two for committing crimes against humanity and genocide. The plaintiff, Shahnaz, is the wife of fish trader Md Milon, who was shot dead in Shimrail area during the Anti-Discrimination Students' Movement on July 21. Shahnaz filed the case with Siddhirganj Police Station shortly after midnight, Officer-in-Charge of the police station Abu Bakar Siddique said, reports our district correspondent. Shamim Osman's son Imtinan Osman Ayon, nephew Azmeri Osman and many of his followers were made accused in the murder case. On July 21, law enforcers and Awami League men clashed with the protesters between Signboard and Shimrail on the Dhaka-Chittagong highway. Milon, who used to live with his family at Mizmizi Purbapara area in Siddhirganj, was shot in the chest while returning home from a fish warehouse in Shimrail area around noon on July 21. According to the case statement, Shamim Osman and other Awami League men fired indiscriminately with firearms and Milon was hit in the chest. Previously, another murder case was filed against 48 people, including Sheikh Hasina, with Narayanganj Sadar Model Police Station on Saturday night."
"Hasina, Quader among 106 sued over killing of Ctg college student","Former prime minister Sheikh Hasina, Awami League General Secretary Obaidul Quader and 106 other people were sued in a murder case in Chattogram. Some 100 to 150 unnamed persons were also made accused in the case filed over the killing of college student Wasim Akram in a clash between activists of Chhatra League, AL's student wing, and protesters in Muradpur area during the student-led quota protests on July 16. Hasina, who resigned and fled the country amid a mass uprising on August 5, is now facing 17 cases -- 14 for murder, one for abduction, and two for committing crimes against humanity and genocide. Wasim's mother Jyotsna lodged the case with Panchlaish Police Station under Chattogram Metropolitan Police last night, said Officer-in-Charge of Panchlaish Police Station Sontos Kumar Chakma. Wasim was involved in the politics of Chhatra Dal, BNP's student wing, according to police and his family members. In the case statement, the mother also accused former education minister Mohibul Hassan Nowfel, former foreign minister Hasan Mahmud, Chattogram city mayor Rezaul Karim, city unit AL's general secretary AJM Nasir Uddin, Chattogram-10 lawmaker Mohiuddin Bacchu, and 12 AL-backed CCC ward councillors. Wasim, a third-year student at social science department at Chattogram College, was a resident of South Mehernama area in Pekua Upazila of Cox's Bazar district. Wasim was the second among five siblings. His father Shafiul Alam and elder brother Arshed Alam live in Saudi Arabia."
Ouster of Hasina: BNP's Hafizuddin commends army,"BNP standing committee member Maj (retd) Hafizuddin Ahmed today congratulated the Bangladesh Army for its role in ""removing"" Sheikh Hasina from power. He was appointed member of the BNP standing committee yesterday. ""I had lost hope, but at the momentous occasion, the Bangladesh Army took sufficient and proper action to remove Sheikh Hasina. I congratulate them for this,"" Hafizuddin said during a programme, organised by Bangladesh Jatiotabadi Muktijoddha Dal at Jatiya Press Club. ""There was a lot of anger against them [Bangladesh Army]. The army is a traditional force. The language of army members, especially senior officers, should be soldier-like. But for the last 14 years, I have seen them giving speeches like those of Chhatra League. What a shame… But in the end, they responded to the people's call and took the right action. They removed the dictator,"" he mentioned. He also questioned police's use of military-grade weapons during the recent crackdown. ""They are the police. Who gave them LMG, MG, 7.62 rifles of the military? Hasina's government did. These weapons were not supposed to be with them,"" he said."
Hasina sued in two more murder cases,"Former prime minister Sheikh Hasina has been accused in two more murder cases. With this, Hasina is now facing 10 cases, including seven for murder, one for abduction, and two for committing crimes against humanity and genocide. In Narayanganj, Hasina, along with former home minister Asaduzzaman Khan and 46 others, was sued over the killing of a 20-year-old man during a clash between protesters and Awami League men on August 5. Abul Bashar Anik, brother of the victim, Abul Hasan Sajan, 20, who was shot in the city's Chashara area, filed the case last night, said Abdus Sattar, officer-in-charge of Narayanganj Sadar Model Police Station. Former MP AKM Shamim Osman, his brother former MP AKM Selim Osman, son Imtinan Osman Ayon, nephew Azmery Osman, brother-in-law Tanvir Ahmed Titu, who is also a director of Bangladesh Cricket Board, and Narayanganj City Corporation Mayor Salina Hayat Ivy's younger brother Ahammad Ali Reza Uzzal were also among the accused. Around 100-150 unnamed people were also accused in the case. According to the case statement, a few hours before the announcement of Hasina's resignation on August 5, Sajan was shot at Chashara during the clash between protesters and Awami League men. ""He died while undergoing treatment at Dhaka Medical College Hospital the following morning,"" Sajan's brother Anik had told The Daily Star earlier. Sajan, son of Jakir Hossain, was a sales representative at a private company. He was living with his family at Kushiara village in Narayanganj's Bandar upazila. In Chattogram, Hasina, along with former education minister Mohibul Hasan Chowdhoury Nowfel and 32 leaders and activists of the Awami League, was sued for the killing of a college student on July 18. Tanvir Siddique, 19, a Higher Secondary Certificate (HSC) examinee from Ashekan Awlia Degree College, was shot dead during a clash between protesters on one side and police and AL activists on the other side in the port city's Bahaddarhat area. His uncle, Mohammad Parvez, filed the case with Chandgaon Police Station late Friday night, accusing 34 people and 100 to 150 unnamed individuals, the police station's Officer-in-Charge Jahidul Kabir told The Daily Star. He said, ""Three people were killed during the violence in Bahaddarhat area on July 18. The plaintiff mentioned the two other victims' names in the case statement."" Jubo League leader Babar Ali and three ward councillors of Chattogram City Corporation -- Nur Mostafa Tinu, Saibal Das Sumon, and Esrarul Haque -- were also among the accused. The case statement said armed Chhatra League and Jubo League activists opened fire on the protesters. [Our staff correspondent from Chattogram and district correspondent from Narayanganj contributed to this report.]"
UK shouldn’t offer asylum to Hasina,"Bangladesh origin British MP Rupa Huq has said it would be unwise for the UK to give refuge to Sheikh Hasina. ""As a British Bangladeshi MP, my inbox is a lightning rod for Bangladeshi issues worldwide. At the moment, pleading mails ask me to 'ban the butcher' and similar requests as it is rumoured London is her next destination,"" she wrote in an opinion column published by the Standard newspaper of UK on Friday. ""I personally think given the deep unpopularity of her bloodthirsty regime and political sensitivities around immigration, it'd be unwise for the UK to give refuge to such a high-profile asylum seeker who is subject of an International Criminal Court application,"" Huq opined. Huq wrote that the recent student unrest, where hundreds of unarmed minors were killed by police under a ""shoot on sight"" policy resembling that of stormtroopers, sparked protests by expatriates in Paris, Rome, Manchester, Trafalgar Square and Middle East. Many Bangladeshis think she should return to face charges there, she said. Huq said there is a collective sense of relief among her Bangladeshi cousins, as the atmosphere of fear surrounding any criticism of the government seems to be easing. However, risks remain, she said. The deposed camp argues they maintained stability, but as elections approach, it's time for a change, she added. Instead of the ongoing feud between two families that has marked Bangladesh's history, the country should aim for a fresh start, she said."
Hasina accused in another murder case,"Another murder case was filed today against former prime minister Sheikh Hasina and 15 others over the death of a 12-year-old school student in Mohammadpur during the quota protests on July 19. The other accused are Awami League General Secretary Obaidul Quader, former ministers -- Asaduzzaman Khan, Anisul Huq, Tajul Islam, Jahangir Kabir Nanak, Hasan Mahmud and Mohammad A Arafat –, former private industry affairs adviser to former prime minister Salman F Rahman and former lawmaker Mostofa Jalal Mohiuddin, former inspector general of police Chowdhury Abdullah Al Mamun, Rab's former DG Harun Or Rashid, former DMP commissioner Habibur Rahman, former Additional IGP Kh Mahid Uddin, former DB (DMP) chief Harun Or Rashid and former DMP joint commissioner Biplob Kumar Sarker. Abdullah Abu Sayeed Bhuiyan, a resident of Tejgaon, today filed the case with the court of Dhaka Metropolitan Magistrate Rajesh Chowdhury over the death of a student, Jobayed Hossain Imon, 12, in police firing in Dhaka's Mohammadpur area during quota reform protests on July 19. This is the fifth case, and the third murder case, lodged against Hasina after she resigned and went to India amid a mass upsurge on August 5. After a hearing, the magistrate recorded the complainant's statement and directed the officer-in-charge of Mohammadpur Police Station to register the complaint as a first information report (FIR), Md Nur Alam, a court staffer, told The Daily Star. In the case, several unnamed Rab personnel have also been accused."
Bangabandhu shouldn’t suffer for Hasina’s deeds,"Kader Siddique Bir Uttam, the president of the Krishak Sramik Janata League, was attacked while attempting to pay his respects to the memory of Bangabandhu Sheikh Mujibur Rahman at Dhanmondi 32 in the capital. On Thursday morning, his car was vandalised. Kader Siddique told The Daily Star, ""I went to pay respect [to Bangabandhu] at seven in the morning, but I couldn't. It felt nice that a few people respectfully asked me to go back… I was inside the car. However, some people threw stones and vandalised the car with sticks. After that, I left."" Regarding the restriction on entering Bangabandhu's residence, he said, ""Throughout history, whenever there is a change, a lot happens during those unstable times. If the anti-discrimination student movement cannot keep up with people's expectations, its achievements will be lost. Today, I saw some people tied up with ropes [near the Dhanmondi 32 area], which is unacceptable."" The veteran freedom fighter urged the students and youth to differentiate between justice and vengeance. ""If someone commits a crime, they should be punished, but suppressing opposing views is not right,"" he added. ""I also want to say that Sheikh Hasina and Bangabandhu should not be treated as the same, nor should Sheikh Hasina and the Awami League be equated. It would be wrong to try to destroy the Awami League due to Sheikh Hasina's flawed leadership,"" said Kader Siddique."
India pressed US to go easy on Hasina: report,"A year before she was deposed on August 5 in a student uprising, Indian officials began to lobby their US counterparts to stop pressuring Sheikh Hasina, the ironfisted prime minister of neighboring Bangladesh, The Washington Post said quoting US and Indian officials. According to its report, US diplomats had publicly harangued the 76-year-old Hasina for jailing thousands of her rivals and critics ahead of an election scheduled for last January. The Biden administration had sanctioned a Bangladeshi police unit under Hasina's command accused of carrying out extrajudicial abductions and killings and had threatened imposing visa restrictions on Bangladeshis who undermined democracy or committed human rights abuses. But in a series of meetings, Indian officials demanded that the United States tone down its pro-democracy rhetoric. If the opposition were allowed to gain power in an open election, Indian officials argued, Bangladesh would become a breeding ground for Islamist groups posing a threat to India's national security. ""You approach it at the level of democracy, but for us, the issues are much, much more serious and existential,"" said an Indian government adviser who spoke on the condition of anonymity to discuss the private talks. ""There were a lot of conversations with the Americans where we said, 'This is a core concern for us, and you can't take us as a strategic partner unless we have some kind of strategic consensus.'"" Ultimately, the Biden administration substantially softened its criticism and shelved threats of further sanctions against Hasina's government, disappointing many in Bangladesh. US officials say it was a calculated decision that had little to do with Indian pressure. Many details of the bilateral discussions and US deliberations have not been reported previously. Now, after protesters defied the army's curfew orders and marched on Hasina's official residence, compelling her to flee to India, policymakers in both New Delhi and Washington are forced to confront whether they mishandled Bangladesh. ""There is always a balancing act in Bangladesh, as there is in many places where the situation on the ground is complicated and you want to work with the partners you have in a way that is not inconsistent with what the American people expect,"" said a US official, who like several others interviewed spoke on the condition of anonymity because of the matter's diplomatic sensitivity. In the months leading up to the January election, divisions emerged within the US government over how to handle Bangladesh. Some in the US State Department, including then-Ambassador Peter Haas and other embassy officials, argued for a tougher stance against Hasina, particularly since President Joe Biden had campaigned on a foreign policy plank of restoring democracy, people familiar with the matter said. Haas, who has since retired, declined to comment. Other US officials felt there was little to be gained from further alienating Hasina and risking the safety of US diplomats, including Haas, who had received threats from Hasina's followers. Some White House officials also considered the downside of antagonising India, which made a series of appeals to the US that it moderate its pressure on Hasina, including when Indian Minister of External Affairs S Jaishankar and Defense Minister Rajnath Singh met with Secretary of State Antony Blinken and Defense Secretary Lloyd Austin in November in New Delhi, according to the people familiar with the matter. Indian national security adviser Ajit Doval also played a key role in presenting the Indian case during a visit to Washington that autumn, one of those people said. For India, the dramatic developments in Bangladesh have turned a spotlight on its decade-long, all-in bet on Hasina, even as she grew autocratic and unpopular. For the United States, the episode has highlighted a growing dilemma: While India is seen by the Biden administration as a crucial partner in countering China, India itself is increasingly viewed by its smaller neighbors in South Asia as a meddling, aggressively nationalist power under Prime Minister Narendra Modi. In January, after Hasina claimed victory in a one-sided election with many of her opponents in jail or in hiding, Indian officials endorsed the election results, fueling calls from the Bangladeshi opposition for a boycott of Indian imports. Last year, in the tiny Indian Ocean country of the Maldives, Mohamed Muizzu rose to power as president by campaigning on an ""India Out"" platform. And in Sri Lanka, anti-Indian sentiment flared this year after Modi claimed on the campaign trail that his opponents gave India's rightful territory cheaply away to Sri Lanka. ""The US has built its relationship with India and has this tendency to defer to its wishes in the region, and probably nowhere was that more evident than Bangladesh,"" said Jon Danilowicz, a retired US diplomat who served as deputy chief of mission in Dhaka. ""But the risk is like Iran 1979: If you're seen as colluding with the dictator, when the dictator falls, you're left playing catch-up."" (The United States strongly backed the autocratic shah of Iran before he was overthrown during the Islamic Revolution.) Now, Danilowicz added, ""New Delhi and Washington have to show some humility and acknowledge they got Bangladesh wrong by not siding with the Bangladeshi people and their democratic aspirations."" After Hasina's ouster, which followed weeks of unrest in which hundreds of protesters were killed, Indian officials have publicly changed tack and expressed willingness to work with whoever comes to power. Last week, Modi sent his ""best wishes"" to Muhammad Yunus, the Nobel Prize-winning banker who took charge of Bangladesh's interim government, even though he criticised India for backing Hasina. Yunus has called for new, free and fair elections once stability is restored in the country. The State Department endorsed Yunus, with spokesman Matthew Miller saying the United States hoped to see ""the Bangladeshi people decide the future of the Bangladeshi government."" Aside from the United States, India had simultaneously warned other Western governments about the dangers of the opposition Bangladeshi Nationalist Party (BNP) returning to power. ""It was intense,"" recalled an official from a Western country allied with the United States. ""They started briefing Western governments that Bangladesh could become the next Afghanistan, that the BNP could lead to instability, violence and terror."" Indian officials say they have reason to feel burned by the Bangladeshi opposition. During the rule of Hasina's rivals, the BNP, in the mid-2000s, militants smuggled weapons to attack northeast India and trained in camps inside Bangladesh with the help of Pakistani intelligence, Indian officials say. Indian and US officials say this experience with BNP rule explained why India had been so adamant on keeping Hasina in power for 15 years. BNP leaders, who could win if elections are soon held, say they have met Indian officials in recent years to mend ties and assure them that India — and Hindus in Bangladesh — would be safe if India stopped propping up Hasina and the BNP returned. ""We've been in touch with India, trying to tell them, 'Don't put all your eggs in one basket,'"" said Amir Khosru Mahmud Chowdhury, a senior BNP leader. ""We have tried to assuage whatever concerns India has. It would be stupid for both sides to carry the baggage of the past."" As India grapples with the shock of suddenly losing one of its closest allies, Indian foreign policy circles and media have been awash with speculation that Washington orchestrated the removal of Hasina, who has long had a chilly relationship with the United States. US officials have staunchly denied the claim. Others in New Delhi say India was to blame for propping up an autocrat for so long. A former senior Indian national security official said it made sense, in theory, to support Hasina, but New Delhi did not grasp the situation on the ground. ""Everybody who came from Dhaka were giving the same feedback that anti-India feelings are at an unprecedented level, yet we calculated that she has full control over the administrative and coercive arms of the state,"" the former Indian official said. ""We thought repeated attempts to destabilise the government have failed, so she will manage again. The truth is, the whole thing just needed a spark to set the whole house on fire."""
Hasina's 'first statement' after ouster,"Former prime minister Sheikh Hasina, now in India after the fall of her government following a mass uprising, today demanded an investigation into the killings, vandalism and arson carried out in the name of agitation. She also demanded that the culprits be identified and brought to justice. Sajeeb Wazed Joy, Hasina's son, posted her statement on his verified Facebook page tonight. Hasina was compelled to step down on August 5 following the student protests, which saw over 500 people killed. In the statement, she said, ""Since July, lots of lives have been lost in violence, arson in the name of protests. I express my condolences and prayers for the victims, including students, teachers, police, journalists, cultural activists and a pregnant police woman, members of Awami League and its associate bodies, pedestrians and various professionals."" She conveyed sympathy to the bereaved families. In her statement, Hasina recalled the massacre of August 15, 1975 when Bangabandhu Sheikh Mujibur Rahman and most of his family members were assassinated. Hasina, the eldest daughter of Bangabandhu, also expressed grief over the vandalism and arson at the Bangabandhu Memorial Museum at Dhanmondi 32 and sought justice from country's people. She urged all to observe the National Mourning Day on August 15 in a befitting manner by placing floral wreaths at Bangabandhu Bhaban and offering prayers."
Another murder case filed against Hasina,"A murder case was filed against former prime minister Sheikh Hasina and 23 others over the death of Dhaka Degree College student Foijul Islam Rajon, 18, in the capital's Kafrul area on July 19. This is the second murder case filed against Hasina since she resigned and fled the country in the face of a mass uprising on August 5. The victim's brother Md Rajib filed the case with the Court of Dhaka Metropolitan Magistrate Ahmed Humayun Kabir. Former home minister Asaduzzaman Khan, former Awami League general secretary Obaidul Quader, former law minister Anisul Huq, former inspector general of police Chowdhury Abdullah Al-Mamun, former DB chief Harun Or Rashid, former DMP commissioner Habibur Rahman and former DMP joint commissioner Biplob Kumar Sarkar are among the accused. After the hearing, the magistrate recorded the statement of complainant and asked the officer-in-charge of Kafrul Police Station to register it as a first information report. Earlier today, five people, including Hasina, Asaduzzaman and Anisul, were sued over the abduction and torture of Supreme Court lawyer Sohel Rana in February 2015. Yesterday, a case was filed against Hasina, Asaduzzaman and five others over the death of grocery shop owner Abu Sayed in police firing in the capital's Mohammadpur area during quota reform protests on July 19."
